component,file_path,type,description,onchain_mapping,test_status
Smart Contract,contracts/programs/goalworld_program/src/lib.rs,Anchor Rust Program,Core on-chain smart contract handling fixtures, bets, claiming payouts, daily coach claims, builder fund splits and epoch transitions,FbDhM4itBS2Cco7c7PbNvC98Fx7Y5HxqXS1JuXdNcBwg,Verified via anchor test --validator legacy
TypeScript SDK,sdk/src/index.ts,npm package,Shared client SDK containing program type definitions (IDL), instructions generation, transaction builders, and PDA derivations consumed by API and webapp,"PDA derivations (Fixture, Vault, Coach, daily claim limits)",Verified via tsc compilation
Sports Data Oracle,oracle/src/index.ts,Node.js CLI Daemon,Watches sports API feeds to sync match fixtures on-chain, records finished player stats, checks rarity yield configurations, and executes vault buybacks,Invokes lib.rs complete_fixture & record_player_match,Verified via npm run lint
Express REST API,api/src/index.ts,Express App,Provides local query cache, operational status checks, economy metrics endpoints, and coach AI chat endpoint,Queries RPC for Vault/Config PDAs,Verified via npm run lint
React WebApp,webapp/src/App.tsx,React/Vite SPA,Frontend interface containing the Estadio panel for devnet bet claims, wallet interactions, simulation badges, and operation dashboard overlays,Reads on-chain program accounts & submits place_bet / claim_bet txs,Vite dev server compiles successfully
